{
  "id": "babaghanoush",
  "title": "Babaghanoush",
  "image": "images/babaghanoush.jpg",
  "course": "starter",
  "status": "empty",
  "starred": false,
  "tags": [
    "vegetarian",
    "middle-eastern",
    "apero"
  ],
  "servings": null,
  "yield": null,
  "time": {
    "active": null,
    "total": null
  },
  "ahead": null,
  "notes": [],
  "source": null,
  "ingredients": [],
  "steps": []
}
