{
  "id": "bowls",
  "title": "Bowls",
  "image": "images/bowls.jpg",
  "course": "main",
  "status": "empty",
  "starred": false,
  "tags": [],
  "servings": null,
  "yield": null,
  "time": {
    "active": null,
    "total": null
  },
  "ahead": null,
  "notes": [
    "Source was a ChatGPT chat link, not accessible."
  ],
  "source": null,
  "ingredients": [],
  "steps": []
}
