{
  "id": "flammenkueche",
  "title": "Flammenkueche",
  "image": "images/flammenkueche.jpg",
  "course": "main",
  "status": "empty",
  "starred": true,
  "tags": [
    "pork",
    "french"
  ],
  "servings": null,
  "yield": null,
  "time": {
    "active": null,
    "total": null
  },
  "ahead": null,
  "notes": [],
  "source": null,
  "ingredients": [],
  "steps": []
}
