{
  "id": "potato-gratin",
  "title": "Potato gratin",
  "image": null,
  "course": "side",
  "status": "empty",
  "starred": false,
  "tags": [
    "potato",
    "vegetarian"
  ],
  "servings": null,
  "yield": null,
  "time": {
    "active": null,
    "total": null
  },
  "ahead": null,
  "notes": [],
  "source": null,
  "ingredients": [],
  "steps": []
}
