{
  "id": "tartiflette",
  "title": "Tartiflette",
  "image": "images/tartiflette.jpg",
  "course": "main",
  "status": "empty",
  "starred": false,
  "tags": [
    "potato",
    "cheese",
    "french",
    "winter"
  ],
  "servings": null,
  "yield": null,
  "time": {
    "active": null,
    "total": null
  },
  "ahead": null,
  "notes": [],
  "source": null,
  "ingredients": [],
  "steps": []
}
