{
  "id": "rosti",
  "title": "Rösti",
  "image": "images/rosti.jpg",
  "course": "side",
  "status": "empty",
  "starred": false,
  "tags": [
    "potato",
    "vegetarian",
    "swiss"
  ],
  "servings": null,
  "yield": null,
  "time": {
    "active": null,
    "total": null
  },
  "ahead": null,
  "notes": [],
  "source": null,
  "ingredients": [],
  "steps": []
}
