{
  "id": "pot-au-feu",
  "title": "Pot-au-feu",
  "image": "images/pot-au-feu.jpg",
  "course": "main",
  "status": "draft",
  "starred": false,
  "tags": [
    "red-meat",
    "french",
    "winter",
    "weekend"
  ],
  "servings": 4,
  "yield": null,
  "time": {
    "active": 60,
    "total": 210
  },
  "ahead": "Soak the marrow bones 2 h ahead in cold salted water.",
  "notes": [],
  "source": null,
  "ingredients": [
    {
      "id": "chuck",
      "amount": 600,
      "unit": "g",
      "name": "beef chuck, paleron",
      "prep": null,
      "category": "meat-fish"
    },
    {
      "id": "shank",
      "amount": 600,
      "unit": "g",
      "name": "bone-in beef shank, gîte",
      "prep": null,
      "category": "meat-fish"
    },
    {
      "id": "water",
      "amount": 3000,
      "unit": "ml",
      "name": "cold water",
      "prep": null,
      "category": "staple"
    },
    {
      "id": "onion",
      "amount": 2,
      "unit": null,
      "name": "onion",
      "prep": "peeled and halved",
      "category": "produce"
    },
    {
      "id": "clove",
      "amount": 4,
      "unit": null,
      "name": "whole clove",
      "prep": null,
      "category": "pantry"
    },
    {
      "id": "thyme",
      "amount": 4,
      "unit": null,
      "name": "thyme sprig",
      "prep": null,
      "category": "produce"
    },
    {
      "id": "bay",
      "amount": 2,
      "unit": null,
      "name": "bay leaf",
      "prep": null,
      "category": "produce"
    },
    {
      "id": "peppercorns",
      "amount": 1,
      "unit": "tsp",
      "name": "black peppercorns",
      "prep": null,
      "category": "staple"
    },
    {
      "id": "salt",
      "amount": 1,
      "unit": "tbsp",
      "name": "salt",
      "prep": null,
      "category": "staple"
    },
    {
      "id": "parsley-stems",
      "amount": 10,
      "unit": "g",
      "name": "flat-leaf parsley",
      "prep": "stems only, tied together",
      "category": "produce"
    },
    {
      "id": "cornichon",
      "amount": 6,
      "unit": null,
      "name": "cornichon",
      "prep": null,
      "category": "canned"
    },
    {
      "id": "capers",
      "amount": 2,
      "unit": "tbsp",
      "name": "capers",
      "prep": null,
      "category": "canned"
    },
    {
      "id": "fish-sauce",
      "amount": 1,
      "unit": "tsp",
      "name": "fish sauce",
      "prep": null,
      "category": "canned"
    },
    {
      "id": "vinegar",
      "amount": 1,
      "unit": "tbsp",
      "name": "red wine vinegar",
      "prep": null,
      "category": "pantry"
    },
    {
      "id": "parsley-leaves",
      "amount": 30,
      "unit": "g",
      "name": "flat-leaf parsley",
      "prep": "leaves picked",
      "category": "produce"
    },
    {
      "id": "olive-oil",
      "amount": 80,
      "unit": "ml",
      "name": "olive oil",
      "prep": null,
      "category": "pantry"
    },
    {
      "id": "cabbage",
      "amount": 200,
      "unit": "g",
      "name": "savoy cabbage",
      "prep": "halved, core trimmed but left attached",
      "category": "produce"
    },
    {
      "id": "leek",
      "amount": 2,
      "unit": null,
      "name": "leek",
      "prep": "trimmed, halved lengthwise, washed, tied together",
      "category": "produce"
    },
    {
      "id": "turnip",
      "amount": 150,
      "unit": "g",
      "name": "turnips",
      "prep": "peeled and quartered",
      "category": "produce"
    },
    {
      "id": "potato",
      "amount": 400,
      "unit": "g",
      "name": "waxy potatoes",
      "prep": "peeled and halved",
      "category": "produce"
    },
    {
      "id": "carrot",
      "amount": 200,
      "unit": "g",
      "name": "carrots",
      "prep": "peeled, cut into 8 cm lengths",
      "category": "produce"
    },
    {
      "id": "celeriac",
      "amount": 150,
      "unit": "g",
      "name": "celeriac",
      "prep": "peeled, cut into large wedges",
      "category": "produce"
    },
    {
      "id": "marrow",
      "amount": 4,
      "unit": null,
      "name": "marrow bone",
      "prep": null,
      "category": "meat-fish"
    },
    {
      "id": "bread",
      "amount": 4,
      "unit": null,
      "name": "thick slice of rustic bread",
      "prep": null,
      "category": "bakery"
    },
    {
      "id": "garlic",
      "amount": 2,
      "unit": null,
      "name": "garlic clove",
      "prep": "halved",
      "category": "produce"
    },
    {
      "id": "mustard",
      "amount": null,
      "unit": null,
      "name": "Dijon mustard",
      "prep": null,
      "category": "canned"
    }
  ],
  "steps": [
    {
      "section": "Broth",
      "cue": "Start the broth",
      "text": "Put {chuck} and {shank} in a large pot, cover with {water} and bring to a boil. Skim until the broth stays clear.",
      "timer": null
    },
    {
      "section": null,
      "cue": "Add the aromatics",
      "text": "Stud {onion} with {clove}. Add to the pot with {thyme}, {bay}, {peppercorns}, {salt} and {parsley-stems}.",
      "timer": null
    },
    {
      "section": null,
      "cue": "Simmer",
      "text": "Reduce to the gentlest simmer, an occasional bubble only. Partially cover.",
      "timer": 150
    },
    {
      "section": "Sauce verte",
      "cue": "Make the sauce verte",
      "text": "Meanwhile, fill a small blender with {cornichon}, {capers}, {fish-sauce}, {vinegar} and {parsley-leaves}. Pulse until roughly chopped.",
      "timer": null
    },
    {
      "section": null,
      "cue": "Add the oil",
      "text": "Add {olive-oil} and pepper. Blend briefly, until combined but still slightly chunky.",
      "timer": null
    },
    {
      "section": "Vegetables",
      "cue": "Blanch the cabbage",
      "text": "Bring a pot of salted water to a boil and blanch {cabbage}.",
      "timer": 3
    },
    {
      "section": null,
      "cue": "Set aside",
      "text": "Drain and set aside with {leek}.",
      "timer": null
    },
    {
      "section": null,
      "cue": "Add the roots",
      "text": "After 2.5 h, add {turnip}, {potato}, {carrot} and {celeriac}. Simmer.",
      "timer": 20
    },
    {
      "section": null,
      "cue": "Finish the vegetables",
      "text": "Add the leeks and cabbage. Simmer until all the vegetables are tender.",
      "timer": 20
    },
    {
      "section": "Marrow and bread",
      "cue": "Grill the marrow",
      "text": "Meanwhile, grill {marrow} cut side up on a hot grill until bubbling, soft and golden on top.",
      "timer": 15
    },
    {
      "section": null,
      "cue": "Salt the marrow",
      "text": "Off the grill, sprinkle with coarse sea salt.",
      "timer": null
    },
    {
      "section": null,
      "cue": "Grill the bread",
      "text": "Grill {bread} until charred on both sides. Rub immediately with {garlic}.",
      "timer": null
    },
    {
      "section": "Serving",
      "cue": "Slice and plate",
      "text": "Slice the meat thickly against the grain. Arrange on a warm platter: meat, vegetables, marrow bones, garlic bread.",
      "timer": null
    },
    {
      "section": null,
      "cue": "Serve",
      "text": "Strain the broth into bowls. Put on the table: sauce verte, {mustard}, coarse sea salt.",
      "timer": null
    }
  ]
}
